{
  "schema_version": "opennori/architecture-apply-v1",
  "id": "opennori-self-activity-cli-response-boundary",
  "goal_id": "opennori-self",
  "criterion_id": "AC-A-8",
  "status": "aligned",
  "baseline": {
    "profile": "typescript-agent-state-cli",
    "profile_title": "TypeScript Agent State CLI",
    "accepted_at": "2026-06-23T06:28:29.131Z"
  },
  "summary": "Activity CLI responses will become lightweight dashboard signal acknowledgements while the full dashboard snapshot remains available as the persisted snapshot projection.",
  "fit": "The confirmed baseline treats activity as live dashboard projection, not Product AC evidence, report output, or context export. Returning full snapshots from every activity command blurs this boundary and can flood agent context even though the source of truth already lives in .opennori and dashboard/MCP read models.",
  "implementation_focus": "Refactor activity command payloads to return activity, target, snapshot_summary, and snapshot_path instead of embedding the full snapshot; add concise human output for activity commands and keep dashboard snapshot persistence unchanged.",
  "evidence": "Read cli activity command, human-output, dashboard tests, agent_next dashboard_activity commands, and kernel snapshot persistence. The current activity command refreshes the full snapshot and embeds it in JSON output.",
  "limitations": "This architecture apply covers activity command response ergonomics only. It does not change event/activity schemas, dashboard APIs, snapshot file contents, MCP resources, or Product AC evidence semantics.",
  "created_at": "2026-06-23T08:30:41.295Z",
  "next": "Use this apply record as architecture context when recording Product AC evidence."
}
