{
  "schema_version": "opennori/architecture-apply-v1",
  "id": "opennori-self-mcp-resource-type-boundary",
  "goal_id": "opennori-self",
  "criterion_id": "AC-A-8",
  "status": "aligned",
  "baseline": {
    "profile": "typescript-agent-state-cli",
    "profile_title": "TypeScript Agent State CLI",
    "accepted_at": "2026-06-23T06:28:29.131Z"
  },
  "summary": "MCP resource payload types are separated from read-only resource construction.",
  "fit": "src/mcp/types.ts now owns MCP resource descriptor and payload types; resources.ts builds read-only context/snapshot/doctor payloads; server.ts registers official SDK resources without adding write tools or state authority.",
  "implementation_focus": "Keep MCP as a read-only context surface while reducing resource builder coupling.",
  "evidence": "src/mcp/types.ts; src/mcp/resources.ts; src/mcp.ts; npx tsc --noEmit --pretty false; npx vitest run test/mcp.test.ts; npm run lint",
  "limitations": "This is a structural boundary improvement only. It does not add MCP tools, HTTP transport, OAuth, or writable MCP semantics.",
  "created_at": "2026-06-23T07:06:23.514Z",
  "next": "Use this apply record as architecture context when recording Product AC evidence."
}
