{
  "schema_version": "opennori/architecture-apply-v1",
  "id": "opennori-self-acceptance-boundary",
  "goal_id": "opennori-self",
  "criterion_id": "AC-A-8",
  "status": "aligned",
  "baseline": {
    "profile": "typescript-agent-state-cli",
    "profile_title": "TypeScript Agent State CLI",
    "accepted_at": "2026-06-23T06:28:29.131Z"
  },
  "summary": "Acceptance module responsibilities are split into Skill-prepared input normalization, subjective-review surface, and discovery/brainstorm Markdown rendering while keeping src/acceptance.ts as the stable export.",
  "fit": "Preserves the OpenNori boundary where CLI stores objective Skill-prepared assets and exposes review surfaces without becoming a subjective AC validator.",
  "implementation_focus": "Added src/acceptance-skill-input.ts, src/acceptance-review.ts, and src/acceptance-markdown.ts; existing CLI/status/report callers continue importing through src/acceptance.ts.",
  "evidence": "npm run lint",
  "limitations": "",
  "created_at": "2026-06-23T08:04:15.730Z",
  "next": "Use this apply record as architecture context when recording Product AC evidence."
}
