{
  "schema_version": "opennori/architecture-apply-v1",
  "id": "opennori-self-central-type-barrel-removal",
  "goal_id": "opennori-self",
  "criterion_id": "AC-A-8",
  "status": "aligned",
  "baseline": {
    "profile": "typescript-agent-state-cli",
    "profile_title": "TypeScript Agent State CLI",
    "accepted_at": "2026-06-23T06:28:29.131Z"
  },
  "summary": "Removed the central src/types.ts barrel so OpenNori source and tests import owned domain type modules directly.",
  "fit": "This follows the TypeScript agent-state CLI baseline by keeping type ownership in domain modules such as types/common, types/lifecycle, mcp/types, cli/command-types, and lifecycle setup/plugin-sync types instead of a repo-wide catch-all barrel.",
  "implementation_focus": "Type boundary收口：删除中心类型桶，保留领域类型模块和现有 public command/resource surfaces。",
  "evidence": "src/types.ts removed; test/mcp.test.ts imports JsonObject and NoriResult from domain type modules; test/module-boundaries.test.js asserts the central barrel is absent; npx tsc --noEmit --pretty false; npx vitest run test/module-boundaries.test.js test/mcp.test.ts",
  "limitations": "This is an internal type-boundary refactor. It does not redesign all domain types or add runtime behavior.",
  "created_at": "2026-06-23T10:40:10.083Z",
  "next": "Use this apply record as architecture context when recording Product AC evidence."
}
