{
  "schema_version": "opennori/architecture-apply-v1",
  "id": "opennori-self-generated-markdown-review-boundary",
  "goal_id": "opennori-self",
  "criterion_id": "AC-A-8",
  "status": "aligned",
  "baseline": {
    "profile": "typescript-agent-state-cli",
    "profile_title": "TypeScript Agent State CLI",
    "accepted_at": "2026-06-23T06:28:29.131Z"
  },
  "summary": "Generated acceptance Markdown is now an explicit review-surface-only helper rather than a contract state or import layer.",
  "fit": "The implementation keeps JSON/dossier files authoritative, moves Markdown parsing/rendering out of contract state construction, requires an OpenNori generated review marker before parsing, and returns authority/side-effect metadata for agent and tool consumers.",
  "implementation_focus": "Harden Markdown review-surface boundaries while preserving the TypeScript CLI/core source-of-truth architecture.",
  "evidence": "src/core/generated-acceptance-markdown.ts; src/core/contract.ts; src/core/dossier-render.ts; README.md; .opennori/protocol.md; npm run test:acceptance; npm run test:docs; npx tsc --noEmit --pretty false; npm run lint",
  "limitations": "This does not add editable Markdown import; future frontmatter or arbitrary Markdown import must go through a new build-vs-buy decision.",
  "created_at": "2026-06-23T06:54:32.195Z",
  "next": "Use this apply record as architecture context when recording Product AC evidence."
}
