{
  "schema_version": "opennori/architecture-apply-v1",
  "id": "opennori-self-dashboard-radar-boundary",
  "goal_id": "opennori-self",
  "criterion_id": "AC-A-8",
  "status": "aligned",
  "baseline": {
    "profile": "typescript-agent-state-cli",
    "profile_title": "TypeScript Agent State CLI",
    "accepted_at": "2026-06-23T06:28:29.131Z"
  },
  "summary": "Dashboard radar model will separate OpenNori read-only node semantics from geometric layout and visual style helpers.",
  "fit": "The confirmed dashboard boundary says the dashboard is a read-only observation surface over snapshots, events, and activity. Keeping status semantics, profile nodes, passed AC aggregation, evidence node ids, layout math, and SVG style rules in one module makes visual code look like state authority and risks drift between selection and rendering.",
  "implementation_focus": "Split dashboard radar helpers into shared status, node projection, geometry, and model assembly modules while preserving the existing radar-model compatibility export and dashboard behavior.",
  "evidence": "Read src/dashboard/src/radar-model.ts, selection.ts, AcceptanceRadarNet.tsx, dashboard types, and dashboard-selection tests. The current radar-model owns status classification, node rawData projection, passed aggregate construction, geometry, and link styling, while selection duplicates passed aggregate and profile node projection.",
  "limitations": "This apply record covers frontend dashboard read-model boundaries only. It does not change the kernel snapshot schema, dashboard API, Product AC evidence semantics, event stream semantics, or dashboard write restrictions.",
  "created_at": "2026-06-23T08:39:21.226Z",
  "next": "Use this apply record as architecture context when recording Product AC evidence."
}
