{
  "schema_version": "opennori/architecture-apply-v1",
  "id": "opennori-self-ac-p-14-report-readability",
  "goal_id": "opennori-self",
  "criterion_id": "AC-P-14",
  "status": "aligned",
  "baseline": {
    "profile": "typescript-agent-state-cli",
    "profile_title": "TypeScript Agent State CLI",
    "accepted_at": "2026-06-18T09:43:44.184Z"
  },
  "summary": "Report readability work stays inside the confirmed TypeScript agent-state CLI baseline: src/core/report.ts owns human report rendering, tests stay in reporting/domain suites, and .opennori remains the evidence source of truth.",
  "fit": "The change modifies only the report renderer and tests around reporting output shape; it does not change the CLI command framework, state model, plugin distribution, dashboard write boundary, or evidence ledger semantics.",
  "implementation_focus": "Make long AC/evidence/source/reviewability/limitations content readable by moving full details out of the Markdown status table into per-criterion detail blocks.",
  "evidence": "src/core/report.ts, test/reporting.test.js, npm run test:reporting, npm run test:quick",
  "limitations": "This architecture apply record proves baseline alignment for the report renderer change; Product AC evidence still needs report output and test verification.",
  "created_at": "2026-06-21T02:48:24.322Z",
  "next": "Use this apply record as architecture context when recording Product AC evidence."
}
