{
  "schema_version": "opennori/architecture-apply-v1",
  "id": "opennori-self-lifecycle-adapter-parser-boundary",
  "goal_id": "opennori-self",
  "criterion_id": "AC-A-8",
  "status": "aligned",
  "baseline": {
    "profile": "typescript-agent-state-cli",
    "profile_title": "TypeScript Agent State CLI",
    "accepted_at": "2026-06-23T06:28:29.131Z"
  },
  "summary": "Lifecycle external command stdout parsing stays inside narrow adapters instead of setup or plugin-sync orchestration.",
  "fit": "The Codex Plugin adapter now absorbs minor Codex CLI plugin-list output drift while setup.ts and plugin-sync.ts continue to consume inspectCodexMarketplace/inspectCodexPlugin probes rather than parsing stdout directly.",
  "implementation_focus": "Keep setup/plugin-sync as preview-confirm orchestration layers and keep external command probing/parsing behind lifecycle adapters.",
  "evidence": "src/lifecycle/adapters/codex-plugin.ts; src/lifecycle/setup.ts; src/lifecycle/plugin-sync.ts; test/lifecycle-adapters.test.ts; npx vitest run test/lifecycle-adapters.test.ts; npm run test:lifecycle; npx tsc --noEmit --pretty false; npm run lint",
  "limitations": "This hardens current Codex CLI text output parsing only. If Codex exposes structured JSON output or an SDK later, OpenNori should prefer that over continued text parsing.",
  "created_at": "2026-06-23T07:02:28.044Z",
  "next": "Use this apply record as architecture context when recording Product AC evidence."
}
