{
  "schema_version": "opennori/architecture-apply-v1",
  "id": "ac-p-4-high-risk-review-risk-boundary",
  "goal_id": "opennori-self",
  "criterion_id": "AC-P-4",
  "status": "aligned",
  "baseline": {
    "profile": "typescript-agent-state-cli",
    "profile_title": "TypeScript Agent State CLI",
    "accepted_at": "2026-06-18T09:43:44.184Z"
  },
  "summary": "High-risk evidence handling now preserves objective evidence results while surfacing confidence and evidence_health review risks; the CLI does not use fixed strong/weak natural-language evidence lists to rewrite subjective sufficiency.",
  "fit": "Aligned with the TypeScript Agent State CLI baseline: objective ledger status, evidence health, and report confidence remain deterministic state outputs; subjective sufficiency stays in Skills, agent review, and user confirmation.",
  "implementation_focus": "src/core/evidence.ts, src/core/report.ts, README, protocol, packaged nori-evidence Skill, and tests around high-risk agent observation and flexible reviewable evidence sources.",
  "evidence": "",
  "limitations": "Full npm run check is still evaluated separately because user-owned dashboard visual files may have lint/whitespace changes outside this boundary slice.",
  "created_at": "2026-06-19T05:05:03.368Z",
  "next": "Use this apply record as architecture context when recording Product AC evidence."
}
