{
  "schema_version": "opennori/architecture-apply-v1",
  "id": "opennori-self-kernel-snapshot-read-model-boundary",
  "goal_id": "opennori-self",
  "criterion_id": "AC-A-8",
  "status": "aligned",
  "baseline": {
    "profile": "typescript-agent-state-cli",
    "profile_title": "TypeScript Agent State CLI",
    "accepted_at": "2026-06-23T06:28:29.131Z"
  },
  "summary": "Kernel snapshot building will be split into active/no-goal read models, criteria projection, agent activity summary, and history summary so dashboard/MCP observe a clear outcome model instead of a mixed builder.",
  "fit": "The confirmed baseline treats .opennori JSON state as authoritative and dashboard/MCP snapshots as read-only projections. Snapshot code must surface goal, current gap, completion, profile, architecture, and events without becoming a second state layer or process log.",
  "implementation_focus": "Refactor src/kernel/snapshot-builder.ts into focused read-model modules while preserving buildSnapshot, refreshSnapshot, snapshot schema, dashboard tests, and MCP read-only behavior.",
  "evidence": "Read snapshot-builder.ts, snapshot-outcome.ts, snapshot-paths.ts, dashboard tests, MCP snapshot resource test, and dashboard UI consumption. snapshot-builder.ts currently mixes history summary, agent summary, active goal assembly, no-goal assembly, criteria projection, and event replay.",
  "limitations": "This architecture apply covers internal snapshot read-model boundaries only. It does not change dashboard UI, snapshot schema fields, MCP resources, event schema, or .opennori source-of-truth semantics.",
  "created_at": "2026-06-23T08:26:30.977Z",
  "next": "Use this apply record as architecture context when recording Product AC evidence."
}
