{
  "schema_version": "opennori/architecture-apply-v1",
  "id": "opennori-self-command-boundary-doc-sync",
  "goal_id": "opennori-self",
  "criterion_id": "AC-A-8",
  "status": "aligned",
  "baseline": {
    "profile": "typescript-agent-state-cli",
    "profile_title": "TypeScript Agent State CLI",
    "accepted_at": "2026-06-23T06:28:29.131Z"
  },
  "summary": "OpenNori repository routing, testing strategy, CLI build-vs-buy decision, and local product-development Skill now document the thin-command and narrow-import boundary for future command work.",
  "fit": "Fits the confirmed TypeScript agent-state CLI baseline by turning the evidence-command narrow import slice into persistent architecture guidance for future agents, without changing Product AC semantics or adding subjective hard validators.",
  "implementation_focus": "Update AGENTS.md, docs/testing.md, cli-command-layer build-vs-buy records, and the local nori-product-development Skill with command-module boundary guidance.",
  "evidence": "AGENTS.md; docs/testing.md; .opennori/architecture/decisions/cli-command-layer-adopt-citty-for-long-term-typescript-cli.md; /Users/jarl/code/jarlone/.agents/skills/nori-product-development/SKILL.md; npx vitest run test/docs-schema.test.js test/module-boundaries.test.js; npx tsc --noEmit --pretty false; node ./bin/opennori.js check --root . --json",
  "limitations": "This architecture apply records guidance and decision alignment only. It does not remove every remaining wide barrel import from all CLI command groups.",
  "created_at": "2026-06-23T11:26:01.950Z",
  "next": "Use this apply record as architecture context when recording Product AC evidence."
}
