{
  "schema_version": "opennori/architecture-apply-v1",
  "id": "ac-o-12-full-product-acceptance-surface",
  "goal_id": "opennori-self",
  "criterion_id": "AC-O-12",
  "status": "aligned",
  "baseline": {
    "profile": "typescript-agent-state-cli",
    "profile_title": "TypeScript Agent State CLI",
    "accepted_at": "2026-06-18T09:43:44.184Z"
  },
  "summary": "Complete product acceptance expansion is implemented in packaged Skill behavior, local development Skills, protocol, README, website, and objective asset tests while keeping subjective AC quality out of CLI hard validators.",
  "fit": "Aligned with the TypeScript agent-state CLI baseline: CLI remains deterministic state, Skills handle subjective acceptance discovery, docs/site explain the user-visible product behavior, and tests verify assets rather than judging natural-language AC quality.",
  "implementation_focus": "Packaged Skills and docs define the full acceptance surface rule; examples and tests expose the rule as product asset coverage; website explains it to users.",
  "evidence": "plugins/opennori/skills/nori/SKILL.md; plugins/opennori/skills/nori-acceptance/SKILL.md; plugins/opennori/skills/nori-autogoal/SKILL.md; README.md; .opennori/protocol.md; test/core.test.js; /Users/jarl/code/jarlone/opennori-site/src/pages/index.astro",
  "limitations": "This is an agent behavior protocol and user-review surface, not an automated natural-language quality validator. Real quality still depends on the agent applying the Skill and the user approving or narrowing the Nori Contract.",
  "created_at": "2026-06-18T13:52:48.477Z",
  "next": "Use this apply record as architecture context when recording Product AC evidence."
}
